{
  "type": "object",
  "required": [
    "model_id",
    "instance_count_min",
    "review_basis",
    "migration_source",
    "expected_instances",
    "optional_absent_fields"
  ],
  "additionalProperties": false,
  "properties": {
    "model_id": {
      "const": "hwcloud_vpc"
    },
    "instance_count_min": {
      "type": "integer"
    },
    "review_basis": {
      "type": "string"
    },
    "migration_source": {
      "type": "string"
    },
    "expected_instances": {
      "type": "array",
      "minItems": 1,
      "maxItems": 1,
      "prefixItems": [
        {
          "type": "object",
          "required": [
            "inst_name",
            "assos",
            "resource_name",
            "resource_id",
            "status",
            "cidr",
            "is_default",
            "region"
          ],
          "additionalProperties": false,
          "properties": {
            "inst_name": {
              "type": "string"
            },
            "assos": {
              "type": "array",
              "minItems": 1,
              "maxItems": 1,
              "prefixItems": [
                {
                  "type": "object",
                  "required": [
                    "model_id",
                    "inst_name",
                    "asst_id",
                    "model_asst_id"
                  ],
                  "additionalProperties": false,
                  "properties": {
                    "model_id": {
                      "type": "string"
                    },
                    "inst_name": {
                      "type": "string"
                    },
                    "asst_id": {
                      "type": "string"
                    },
                    "model_asst_id": {
                      "type": "string"
                    }
                  }
                }
              ],
              "items": false
            },
            "resource_name": {
              "type": "string"
            },
            "resource_id": {
              "type": "string"
            },
            "status": {
              "type": "string"
            },
            "cidr": {
              "type": "string"
            },
            "is_default": {
              "type": "boolean"
            },
            "region": {
              "type": "string"
            }
          }
        }
      ],
      "items": false
    },
    "optional_absent_fields": {
      "type": "array",
      "maxItems": 0
    }
  },
  "$schema": "https://json-schema.org/draft/2020-12/schema"
}
